,rank,title,points,counries,days,isoriginal,show_id,type,director,cast,country,date_added,release_year,rating,duration,listed_in,description
55,84,The Crown,"5,607",53,145,YES,s1699,TV Show,,"Claire Foy, John Lithgow, Matt Smith, Vanessa Kirby, Jared Harris, Victoria Hamilton, Eileen Atkins, Jeremy Northam, Alex Jennings, Ben Miles, Pip Torrens, Will Keen, Harry Hadden-Paton, Daniel Ings, Greg Wise, Harriet Walter, Lia Williams, Matthew Goode, Anton Lesser","United Kingdom, United States","November 15, 2020",2020,Adults,4 Seasons,"British TV Shows, International TV Shows, TV Dramas",This drama follows the political rivalries and romance of Queen Elizabeth II's reign and the events that shaped the second half of the 20th century.
56,86,AlRawabi School for Girls,"5,259",36,62,YES,s278,TV Show,,"Andria Tayeh, Rakeen Sa'ad, Noor Taher, Yara Mustafa, Joanna Arida, Salsabiela, Nadera Emran, Reem Saadeh",Jordan,"August 12, 2021",2021,Teens,1 Season,"International TV Shows, TV Dramas, Teen TV Shows",The bullied outcasts at prestigious Al Rawabi School for Girls plot a series of risky takedowns to get back at their tormentors.
57,88,Gabby's Dollhouse,"5,208",53,202,YES,s287,TV Show,,"Laila Lockhart Kraner, Tucker Chandler, Juliet Donenfeld, Maggi Lowe, Donovan Patton, Eduardo Franco, Tara Strong, Secunda Wood, Carla Tassara, Sainty Nelsen",United States,"August 10, 2021",2021,Kids,2 Seasons,Kids' TV,"Cute cats, quirky crafts and colorful magic! Join kitty enthusiast Gabby and her sidekick Pandy Paws as they team up for a series of animated adventures."
58,93,Midnight Mass,"4,860",79,31,YES,s6,TV Show,Mike Flanagan,"Kate Siegel, Zach Gilford, Hamish Linklater, Henry Thomas, Kristin Lehman, Samantha Sloyan, Igby Rigney, Rahul Kohli, Annarah Cymone, Annabeth Gish, Alex Essoe, Rahul Abburi, Matt Biedel, Michael Trucco, Crystal Balint, Louis Oliver",,"September 24, 2021",2021,Adults,1 Season,"TV Dramas, TV Horror, TV Mysteries","The arrival of a charismatic young priest brings glorious miracles, ominous mysteries and renewed religious fervor to a dying town desperate to believe."
59,94,The 100,"4,783",49,177,No,s1879,TV Show,,"Eliza Taylor, Paige Turco, Bob Morley, Marie Avgeropoulos, Christopher Larkin, Henry Ian Cusick, Isaiah Washington, Lindsey Morgan, Devon Bostick, Richard Harmon, Ricky Whittle, Jarod Joseph, Chelsey Reist, Sachin Sahel, Adina Porter","United States, Canada","October 8, 2020",2020,Adults,7 Seasons,"TV Action & Adventure, TV Dramas, TV Sci-Fi & Fantasy","A century after Earth was devastated by a nuclear apocalypse, 100 space station residents are sent to the planet to determine whether it's habitable."
60,95,"Love, Death & Robots","4,588",81,57,YES,s884,TV Show,,"Topher Grace, Mary Elizabeth Winstead, Gary Cole, Samira Wiley, Daisuke Tsuji, Maurice LaMarche, Rebecca Riedy, Helen Sadler, Hayley McLaughlin, Time Winters, Elly Condron, Stefan Kapicic, Bruce Thomas, Jeff Berg, Aaron Himelstein, Carlos Alazraqui, Jill Talley, Brian Bloom, Chris Cox, Michael Benyaer, Fred Tatasciore, Scott Whyte, Josh Brener, Gary Anthony Williams, Chris Parnell, Graham Hamilton, Adam Bartley, Kevin Michael Richardson, Emma Thornett, Henry Douthwaite, Madeleine Knight, Rebecca Banatvala, Kirk Thornton, Yuri Lowenthal, Elaine Tan, Matthew Yang King, Gwendoline Yeo, Neil Kaplan, G.K. Bowes, Courtenay Taylor",United States,"May 14, 2021",2021,Adults,2 Seasons,"TV Action & Adventure, TV Horror, TV Sci-Fi & Fantasy","Terrifying creatures, wicked surprises and dark comedy converge in this NSFW anthology of animated stories presented by Tim Miller and David Fincher."
61,96,Tribes of Europa,"4,546",80,24,YES,s1295,TV Show,,"Henriette Confurius, Emilio Sakraya, David Ali Rashed, Oliver Masucci, Melika Foroutan, Ana Ularu, Robert Finster",Germany,"February 19, 2021",2021,Adults,1 Season,"International TV Shows, TV Action & Adventure, TV Dramas","In post-apocalyptic Europe, amid wars among microstates, three siblings fight for survival as a greater threat looms over the continent."
62,97,The Uncanny Counter,"4,300",21,82,No,s1635,TV Show,,"Cho Byeong-kyu, Yu Jun-sang, Kim Se-jeong, Yeom Hye-ran, Ahn Seok-hwan, Moon Sook, Choi Yoon-young, Lee Hong-nae",South Korea,"November 29, 2020",2020,Teens,1 Season,"International TV Shows, TV Action & Adventure, TV Dramas","Noodle shop employees by day and demon hunters by night, the Counters use special abilities to chase down malevolent spirits that prey on humans."
63,99,Attack on Titan,"3,997",11,141,No,s779,TV Show,,"Yuki Kaji, Yui Ishikawa, Marina Inoue, Kisho Taniyama, Yu Shimamura, Yu Kobayashi, Shiori Mikami, Hiro Shimono, Ryota Osaka, Yoshimasa Hosoya, Tomohisa Hashizume, Saki Fujita, Hiroshi Kamiya, Daisuke Ono, Romi Park, Keiji Fujiwara, Kazuhiro Yamaji, Yusaku Yara, Takehito Koyasu",Japan,"June 2, 2021",2013,Adults,1 Season,"Anime Series, International TV Shows","With his hometown in ruins, young Eren Yeager becomes determined to fight back against the giant Titans that threaten to destroy the human race."
64,100,Selling Sunset,"3,919",58,29,YES,s2153,TV Show,,,,"August 7, 2020",2020,Adults,3 Seasons,Reality TV,The elite real estate brokers at The Oppenheim Group sell the luxe life to affluent buyers in LA. The drama ramps up when a new agent joins the team.
65,101,Age of Samurai: Battle for Japan,"3,850",81,16,YES,s1273,TV Show,,"Masayoshi Haneda, Masami Kosaka, Hideaki Ito, Hayate, Wilfred Lee, Philippe Koo",United States,"February 24, 2021",2021,Adults,1 Season,"Docuseries, International TV Shows",Dynamic reenactments and expert commentaries bring to life the tumultuous history and power struggles of a warring 16th-century feudal Japan.
66,102,Atypical,"3,813",71,25,YES,s478,TV Show,,"Jennifer Jason Leigh, Keir Gilchrist, Michael Rapaport, Brigette Lundy-Paine, Amy Okuda, Jenna Boyd, Graham Rogers, Nik Dodani",United States,"July 9, 2021",2021,Teens,4 Seasons,"TV Comedies, TV Dramas, Teen TV Shows","When a teen on the autism spectrum decides to get a girlfriend, his bid for more independence puts his whole family on a path of self-discovery."
67,103,Mine,"3,732",26,94,No,s903,TV Show,,"Lee Bo-young, Kim Seo-hyung, Lee Hyun-wook, Ok Ja-yeon, Cha Hak-yeon, Jeong E-suh, Park Hyuk-kwon, Park Won-sook",South Korea,"May 9, 2021",2021,Teens,1 Season,"International TV Shows, TV Dramas","Encaged in a gold-clad life of secrets and lies, two women in a conglomerate family seek to topple all that stands in their way of finding true joy."
68,104,Record of Ragnarok,"3,707",76,25,YES,s701,TV Show,,"Miyuki Sawashiro, Tomoyo Kurosawa, Tomokazu Seki, Soma Saito, Kazuhiro Yamaji, Hikaru Midorikawa, Wataru Takagi, Takahiro Sakurai, Junichi Suwabe, Yukihiro Nozuyama, Hinata Tadokoro, Taisuke Nakano, Tomohiro Yamaguchi, Tatsuhisa Suzuki, Rie Tanaka, Yoshitsugu Matsuoka, Sho Hayami",,"June 17, 2021",2021,Adults,1 Season,"Anime Series, International TV Shows","Before eradicating humankind from the world, the gods give them one last chance to prove themselves worthy of survival. Let the Ragnarok battles begin."
69,106,Law School,"3,532",16,74,YES,s1063,TV Show,,"Kim Myung-min, Kim Beom, Ryu Hye-young, Lee Jung-eun, Park Hyuk-kwon, An Nae-sang, Chung Won-joong, Lee Su-kyoung, Lee David, Go Youn-jung, Hyunwoo",South Korea,"April 14, 2021",2021,Teens,1 Season,"Crime TV Shows, International TV Shows, TV Dramas","When a grim incident occurs at their prestigious school, justice through law is put to a test by a tough law professor and his ambitious students."
70,109,The Seven Deadly Sins,"3,451",69,109,YES,s632,TV Show,,"Yuki Kaji, Sora Amamiya, Misaki Kuno, Aoi Yuki, Tatsuhisa Suzuki, Jun Fukuyama, Mamoru Miyano, Maaya Sakamoto",Japan,"June 28, 2021",2021,Teens,5 Seasons,"Anime Series, International TV Shows","When a kingdom is taken over by tyrants, the deposed princess begins a quest to find a disbanded group of evil knights to help take back her realm."
71,110,Katla,"3,448",66,47,YES,s700,TV Show,,"Guðrún Eyfjörð, Íris Tanja Flygenring, Aliette Opheim, Ingvar Sigurðsson, Þorsteinn Bachmann, Sólveig Arnarsdóttir, Björn Thors",Iceland,"June 17, 2021",2021,Adults,1 Season,"International TV Shows, TV Dramas, TV Mysteries",The catastrophic eruption of subglacial volcano Katla turns a nearby community’s world upside down as mysteries begin to emerge from the ice.
72,111,Disenchantment,"3,383",64,28,YES,s1403,TV Show,,"Abbi Jacobson, Eric André, Nat Faxon, John DiMaggio, Tress MacNeille, Matt Berry, David Herman, Maurice LaMarche, Lucy Montgomery, Billy West",United States,"January 15, 2021",2021,Teens,3 Seasons,"TV Action & Adventure, TV Comedies, TV Sci-Fi & Fantasy","Princess duties call, but she'd rather be drinking. Free-spirited Bean exasperates the king as she wreaks havoc with her demon and elf pals."
73,112,Resurrection: Ertugrul,"3,187",8,311,No,s22,TV Show,,"Engin Altan Düzyatan, Serdar Gökhan, Hülya Darcan, Kaan Taşaner, Esra Bilgiç, Osman Soykut, Serdar Deniz, Cengiz Coşkun, Reshad Strik, Hande Subaşı",Turkey,"September 22, 2021",2018,Teens,5 Seasons,"International TV Shows, TV Action & Adventure, TV Dramas","When a good deed unwittingly endangers his clan, a 13th-century Turkish warrior agrees to fight a sultan's enemies in exchange for new tribal land."
74,115,Miraculous: Tales of Ladybug & Cat Noir,"2,961",38,144,No,s2963,TV Show,Thomas Astruc,"Cristina Vee, Bryce Papenbrook, Keith Silverstein, Mela Lee, Max Mittelman, Carrie Keranen, Stephanie Sheh, André Gordon, Matthew Mercer, Christopher Corey Smith, Philece Sampler, Selah Victor, Marieve Herington, Ben Diskin, Kira Buckland, Erin Fitzgerald, Grant George, Ethan Murray, David Roach, Todd Haberkorn","France, South Korea, Japan, United States","February 1, 2020",2019,Older Kids,5 Seasons,"Kids' TV, TV Action & Adventure","When Paris is in peril, Marinette becomes Ladybug. Little does she know, her school crush Adrien is actually Cat Noir, another city-saving superhero."
75,116,Bling Empire,"2,955",53,36,YES,s1401,TV Show,,,United States,"January 15, 2021",2021,Adults,1 Season,Reality TV,"Follow LA's wildly wealthy Asian and Asian American fun seekers as they go all out with fabulous parties, glamour and drama in this reality series."
76,117,Valeria,"2,953",43,45,YES,s277,TV Show,Inma Torrente,"Diana Gómez, Silma López, Paula Malia, Teresa Riott, Maxi Iglesias, Ibrahim Al Shami",Spain,"August 13, 2021",2021,Adults,2 Seasons,"International TV Shows, Romantic TV Shows, Spanish-Language TV Shows","A writer in creative and marital crises finds support from three friends, who are also discovering themselves. Based on the novels by Elísabet Benavent."
77,118,Control Z,"2,948",35,30,YES,s312,TV Show,,"Ana Valeria Becerril, Michael Ronda, Yankel Stevan, Zion Moreno, Luis Curiel, Samantha Acuña, Macarena García, Fiona Palomo, Andrés Baida, Patricio Gallardo, Iván Aragón, Xabiani Ponce de León, Patricia Maqueo, Rodrigo Cachero, Rocío Verdejo, Mauro Sánchez Navarro, Lidia San José, Thanya López, Renata del Castillo, Arturo Barba, Kariam Castro, Ariana Saavedra, Alexander Holtmann, Nastassia Villasana, Marco Zunino",Mexico,"August 4, 2021",2021,Adults,2 Seasons,"International TV Shows, Spanish-Language TV Shows, TV Dramas","When a hacker begins releasing students' secrets to the entire high school, the socially isolated but observant Sofía works to uncover his/her identity."
78,120,How to Become a Tyrant,"2,866",55,44,YES,s483,TV Show,,Peter Dinklage,,"July 9, 2021",2021,Adults,1 Season,Docuseries,"Ruling with an iron fist requires an aspiring dictator to know the playbook for absolute power, as history's despots prove in this sardonic docuseries."
79,121,S.W.A.T.,"2,814",15,63,No,s7913,Movie,Clark Johnson,"Samuel L. Jackson, Colin Farrell, Michelle Rodriguez, LL Cool J, Josh Charles, Jeremy Renner, Brian Van Holt, Olivier Martinez, Reg E. Cathey, Larry Poindexter, Page Kennedy, Domenick Lombardozzi, James DuMont",United States,"January 1, 2021",2003,Teens,117 min,Action & Adventure,"A veteran cop is tasked with drafting and training a special weapons and tactics team, who soon find themselves up against an international criminal."
80,122,Top Secret UFO Projects: Declassified,"2,779",66,23,YES,s321,TV Show,,,,"August 3, 2021",2021,Older Kids,1 Season,Docuseries,"Though claims of extraterrestrial encounters have long been dismissed, many believe the existence of UFOs is not just likely, but a certainty."
81,123,The Chair,"2,759",61,19,YES,s249,TV Show,,"Sandra Oh, Jay Duplass, Holland Taylor, David Morse, Bob Balaban, Nana Mensah, Everly Carganilla",,"August 20, 2021",2021,Adults,1 Season,"TV Comedies, TV Dramas","At a major university, the first woman of color to become chair tries to meet the dizzying demands and high expectations of a failing English department."
82,126,The Walking Dead,"2,624",49,97,No,s391,TV Show,,"Andrew Lincoln, Steven Yeun, Norman Reedus, Chandler Riggs, Melissa McBride, Lauren Cohan, Danai Gurira, Alanna Masterson, Sonequa Martin-Green, Josh McDermitt, Christian Serratos, Seth Gilliam, Ross Marquand, Lennie James, Emily Kinney, Jon Bernthal",United States,"July 26, 2021",2019,Adults,10 Seasons,"Classic & Cult TV, TV Action & Adventure, TV Dramas","In the wake of a zombie apocalypse, survivors hold on to the hope of humanity by banding together to wage a fight for their own survival."
83,127,Spycraft,"2,580",52,21,YES,s1395,TV Show,,,United States,"January 20, 2021",2021,Adults,1 Season,"Docuseries, Science & Nature TV","The spy game is a serious business, and throughout history, the tools and technologies developed for it have mattered as much as the spies themselves."
84,128,Too Hot to Handle: Brazil,"2,571",42,33,YES,s432,TV Show,,Bruna Louise,,"July 21, 2021",2021,Adults,1 Season,"International TV Shows, Reality TV, Romantic TV Shows","Sizzling hot young Brazilians meet at a dreamy beach resort. But for a shot at R$500,000 in this fun reality show, they'll have to give up sex."
85,131,The Lost Pirate Kingdom,"2,432",73,14,YES,s1206,TV Show,,"James Oliver Wheatley, Sam Callis, Thomas Padley, Evan Milton, Samuel Collings, Miles Yekinni, Jack Waldouck, Mia Tomlinson, Kevin Howarth, Mark Gillis, George Watkins, Derek Jacobi","United States, United Kingdom","March 15, 2021",2021,Adults,1 Season,"Docuseries, Science & Nature TV, TV Action & Adventure",The real-life pirates of the Caribbean violently plunder the world's riches and form a surprisingly egalitarian republic in this documentary series.
86,133,Run On,"2,359",32,73,No,s1529,TV Show,,"Yim Si-wan, Shin Sae-kyeong, Choi Soo-young, Kang Tae-oh, Park Yeong-gyu, Cha Hwa-yeon, Lee Bong-ryeon, Ryu Abell, Seo Jae-hee, Yeon Je-wook, Choi Jae-hyun, Lee Jeong-ha, Park Sung-jun, Lee Hwang-eui, Lee Shin-ki, Kim Dong-yeong, Kim Si-eun, Kim Si-young",South Korea,"December 17, 2020",2020,Adults,1 Season,"International TV Shows, Romantic TV Shows, TV Comedies","Veering off course from his preset path, a track star follows his own pace and heart for the first time after a film translator steps into his life."
87,134,Go Dog Go,"2,297",48,29,YES,s1381,TV Show,,"Michela Luci, Callum Shoniker, Lyon Smith, Tajja Isen, Anand Rajaram, David Berni, Linda Ballantyne, Joshua Graham, Patrick McKenna, Judy Marshak, Martin Roach, Katie Griffin","United States, United Kingdom","January 26, 2021",2021,Kids,1 Season,Kids' TV,"Handy and inventive pup Tag chases adventure with her best pal, Scooch, solving problems and helping the citizens of Pawston along the way."
88,135,Selena: The Series,"2,238",20,41,YES,s921,TV Show,,"Christian Serratos, Gabriel Chavarria, Ricardo Chavira, Noemi Gonzalez, Seidy Lopez, Hunter Reese Peña, Julio Macias, Carlos Alfredo Jr., Jesse Posey, Madison Taylor Baez, Juan Martinez, Daniela Estrada, Paul Rodriguez Jr.","Mexico, United States","May 4, 2021",2020,Older Kids,2 Seasons,TV Dramas,Iconic Mexican-American performer Selena rises to fame as she and her family make sacrifices in order to achieve their lifelong dreams.
89,136,Elite Short Stories: Carla Samuel,"2,229",53,14,YES,s698,TV Show,,"Ester Expósito, Itzan Escamilla",,"June 17, 2021",2021,Adults,1 Season,"International TV Shows, Romantic TV Shows, Spanish-Language TV Shows","Samuel attempts a big, romantic gesture at the airport in order to persuade Carla not to board her flight to London."
90,137,Girl from Nowhere,"2,220",13,63,YES,s517,TV Show,,"Chicha Amatayakul, Thanawetch Siriwattanakul, Pajaree Nantarat, Thitinan Khlangphet, Chonnikan Netjui, Nutthasit Kotimanuswanich, Tatchapol Thitiapichai, Chanicha Boonpanuvichit, Morakot Liu, Ekawat Niratvorapanya, Anuchit Sapanpong, Awat Ratanapintha, Claudia Chakrapan, Piyathida Woramusik, Apasiri Kittithanon, Kunchanuj Kengkarnka, Nutnicha Lueanganankhun",Thailand,"July 6, 2021",2021,Adults,2 Seasons,"International TV Shows, TV Dramas, TV Mysteries","A mysterious, clever girl named Nanno transfers to different schools, exposing the lies and misdeeds of the students and faculty at every turn."
91,138,Tiny Pretty Things,"2,196",57,33,YES,s1553,TV Show,,"Lauren Holly, Kylie Jefferson, Casimere Jollette, Brennan Clost, Barton Cowperthwaite, Bayardo De Murguia, Damon J. Gillespie, Anna Maiche, Daniela Norman, Michael Hsu Rosen, Tory Trowbridge",United States,"December 14, 2020",2020,Adults,1 Season,"TV Dramas, TV Mysteries, TV Thrillers","When an attack brings down the star student at an elite ballet school, her replacement enters a world of lies, betrayal — and cutthroat competition."
92,139,Capitani,"2,120",49,64,YES,s1321,TV Show,,"Luc Schiltz, Sophie Mousel, Claude De Demo, Joe Dennenwald, Konstantin Rommelfangen, Jules Werner, Jil Devresse, Julie Kieffer",Luxembourg,"February 11, 2021",2019,Adults,1 Season,"Crime TV Shows, International TV Shows, TV Dramas","In a Luxembourg village where everyone is keeping secrets, gruff police inspector Luc Capitani investigates the suspicious death of a 15-year-old girl."
93,141,Love Alarm,"2,068",56,22,YES,s1211,TV Show,,"Kim So-hyun, Jung Ga-ram, Song Kang, Ko Min-si, Z. Hera, Shin Seung-ho, Lee Jae-eung, Song Sun-mi",South Korea,"March 12, 2021",2021,Adults,2 Seasons,"International TV Shows, Korean TV Shows, Romantic TV Shows","In a world where an app alerts people if someone in the vicinity likes them, Kim Jojo experiences young love while coping with personal adversities."
94,142,Halston,"2,015",47,18,YES,s880,TV Show,Daniel Minahan,"Ewan McGregor, Bill Pullman, Rebecca Dayan, David Pittu, Krysta Rodriguez, Rory Culkin, Vera Farmiga, Gian Franco Rodriguez, Sullivan Jones, Kelly Bishop, Dilone, James Waterston, Jason Kravits, Mary Beth Peil",United States,"May 14, 2021",2021,Adults,1 Season,TV Dramas,His name built an empire. His style defined an era. American fashion designer Halston skyrockets to fame before his life starts to spin out of control.
95,144,Castlevania,"1,957",67,20,YES,s891,TV Show,,"Richard Armitage, James Callis, Graham McTavish, Alejandra Reynoso, Tony Amendola, Matt Frewer, Emily Swallow",United States,"May 13, 2021",2021,Adults,4 Seasons,"Anime Series, TV Horror, TV Thrillers",A vampire hunter fights to save a besieged city from an army of otherworldly beasts controlled by Dracula himself. Inspired by the classic video games.
96,145,Workin' Moms,"1,924",47,18,YES,s545,TV Show,,"Catherine Reitman, Dani Kind, Juno Rinaldi, Jessalyn Wanlim, Philip Sternberg, Ryan Belleville, Olunike Adeliyi, Dennis Andres, Katherine Barrell, Sarah McVie, Peter Keleghan",Canada,"July 6, 2021",2021,Adults,5 Seasons,"International TV Shows, TV Comedies","Maternity leave is over and it's time for these four moms to return to work while navigating kids, bosses, love and life in modern-day Toronto."
97,147,Crash Landing on You,"1,891",9,180,YES,s3130,TV Show,,"Hyun Bin, Son Ye-jin, Seo Ji-hye, Kim Jung-hyun, Oh Man-seok, Kim Young-min, Kim Jung-nan, Kim Sun-young, Hwangwoo Seul-hye",South Korea,"December 15, 2019",2019,Teens,1 Season,"International TV Shows, Korean TV Shows, Romantic TV Shows","A paragliding mishap drops a South Korean heiress in North Korea – and into the life of an army officer, who decides he will help her hide."
98,148,Fatma,"1,680",44,47,YES,s973,TV Show,,"Burcu Biricik, Uğur Yücel, Mehmet Yılmaz Ak, Hazal Türesan, Gülçin Kültür Şahin, Olgun Toker, Çağdaş Onur Öztürk, Şehsuvar Aktaş, Deniz Şen Hamzaoğlu, Didem İnselel",Turkey,"April 27, 2021",2021,Adults,1 Season,"International TV Shows, TV Dramas, TV Thrillers","Reeling from tragedy, a nondescript house cleaner embarks on a murderous streak as she searches for her missing husband and reckons with old wounds."
99,150,Outlander,"1,642",22,104,No,s1378,TV Show,,"Caitriona Balfe, Sam Heughan, Tobias Menzies, Gary Lewis, Graham McTavish, Lotte Verbeek, Duncan Lacroix, Laura Donnelly, Bill Paterson, Stephen Walters, Grant O'Rourke, Simon Callow, Richard Rankin, Sophie Skelton, David Berry, Romann Berrux, Ed Speleers, Maria Doyle Kennedy, Tim Downie",United States,"January 27, 2021",2018,Adults,4 Seasons,"Romantic TV Shows, TV Action & Adventure, TV Dramas",This epic tale adapted from Diana Gabaldon's popular series of fantasy-romance novels focuses on the drama of two time-crossed lovers.
100,152,Zero Chill,"1,631",49,20,YES,s1207,TV Show,,"Grace Beedie, Dakota Benjamin Taylor, Jade Ma, Jeremias Amoore, Leonardo Fontes, Anastasia Chocholatá, Sarah-Jane Potts, Doug Rao, Tanja Ribič, Oscar Skagerberg, Jerry Kwarteng",United Kingdom,"March 15, 2021",2021,Kids,1 Season,"British TV Shows, Kids' TV, TV Dramas","Talented teen figure skater Kayla is forced to leave everything behind when her family follows her twin brother, Mac, to a prestigious hockey academy."
