,rank,title,points,counries,days,isoriginal,show_id,type,director,cast,country,date_added,release_year,rating,duration,listed_in,description
0,1,Squid Game,"57,980",90,104,YES,s34,TV Show,,"Lee Jung-jae, Park Hae-soo, Wi Ha-jun, Oh Young-soo, Jung Ho-yeon, Heo Sung-tae, Kim Joo-ryoung, Tripathi Anupam, You Seong-joo, Lee You-mi",,"September 17, 2021",2021,Adults,1 Season,"International TV Shows, TV Dramas, TV Thrillers","Hundreds of cash-strapped players accept a strange invitation to compete in children's games. Inside, a tempting prize awaits — with deadly high stakes."
1,3,Lupin,"42,690",83,256,YES,s735,TV Show,,"Omar Sy, Ludivine Sagnier, Clotilde Hesme, Nicole Garcia, Hervé Pierre, Soufiane Guerrab, Antoine Gouy, Fargass Assandé, Vincent Londez, Shirine Boutella","France, United States","June 11, 2021",2021,Adults,2 Seasons,"Crime TV Shows, International TV Shows, TV Action & Adventure","Inspired by the adventures of Arsène Lupin, gentleman thief Assane Diop sets out to avenge his father for an injustice inflicted by a wealthy family."
2,4,Sex/Life,"34,609",82,141,YES,s639,TV Show,,"Sarah Shahi, Mike Vogel, Adam Demos, Margaret Odette",United States,"June 25, 2021",2021,Adults,1 Season,"Romantic TV Shows, TV Dramas",A woman's daring sexual past collides with her married-with-kids present when the bad-boy ex she can't stop fantasizing about crashes back into her life.
3,5,Bridgerton,"33,973",82,146,YES,s1493,TV Show,,"Adjoa Andoh, Julie Andrews, Lorraine Ashbourne, Jonathan Bailey, Ruby Barker, Sabrina Bartlett, Harriet Cains, Bessie Carter, Nicola Coughlan, Phoebe Dynevor, Ruth Gemmell, Florence Hunt, Claudia Jessie, Ben Miller, Luke Newton, Regé-Jean Page, Golda Rosheuvel, Luke Thompson, Will Tilston, Polly Walker",United States,"December 25, 2020",2020,Adults,1 Season,"Romantic TV Shows, TV Dramas",The eight close-knit siblings of the Bridgerton family look for love and happiness in London high society. Inspired by Julia Quinn's bestselling novels.
4,7,Lucifer,"32,230",80,212,YES,s83,TV Show,,"Tom Ellis, Lauren German, Kevin Alejandro, D.B. Woodside, Lesley-Ann Brandt, Scarlett Estevez, Rachael Harris, Aimee Garcia, Tricia Helfer, Tom Welling, Jeremiah W. Birkett, Pej Vahdat, Michael Gladis",United States,"September 10, 2021",2021,Teens,6 Seasons,"Crime TV Shows, TV Comedies, TV Dramas","Bored with being the Lord of Hell, the devil relocates to Los Angeles, where he opens a nightclub and forms a connection with a homicide detective."
5,8,Who Killed Sara?,"30,363",79,88,YES,s870,TV Show,,"Manolo Cardona, Ginés García Millán, Carolina Miranda, Alejandro Nones, Claudia Ramírez, Eugenio Siller, Juan Carlos Remolina, Ximena Lamadrid, Luis Roberto Guzmán, Leo Deluglio, Héctor Jiménez, Ana Lucía Domínguez, Iñaki Godoy, Polo Morín, Andrés Baida, Fátima Molina, Marco Zapata",Mexico,"May 19, 2021",2021,Adults,2 Seasons,"Crime TV Shows, International TV Shows, Spanish-Language TV Shows","Hell-bent on exacting revenge and proving he was framed for his sister's murder, Álex sets out to unearth much more than the crime's real culprit."
6,11,Ginny & Georgia,"28,496",78,112,YES,s1276,TV Show,,"Brianne Howey, Antonia Gentry, Diesel La Torraca, Jennifer Robertson, Felix Mallard, Sara Waisglass, Scott Porter, Raymond Ablack",United States,"February 24, 2021",2021,Teens,1 Season,"Romantic TV Shows, TV Comedies, TV Dramas","Free-spirited Georgia and her two kids, Ginny and Austin, move north in search of a fresh start but find that the road to new beginnings can be bumpy."
7,13,You,"23,940",90,87,YES,s3097,TV Show,Lee Toland Krieger,"Penn Badgley, Elizabeth Lail, Shay Mitchell, John Stamos, Luca Padovan, Zach Cherry",United States,"December 26, 2019",2019,Adults,2 Seasons,"Crime TV Shows, Romantic TV Shows, TV Dramas","Obsessed with an aspiring writer, a charming bookstore manager goes to extreme measures to insert himself into her life."
8,15,Vincenzo,"20,307",56,308,YES,s1286,TV Show,,"Song Joong-ki, Jeon Yeo-been, Ok Taec-yeon, Yoo Jae-myung, Kim Yeo-jin, Kwak Dong-yeon, Cho Han-cheul",South Korea,"February 21, 2021",2021,Teens,1 Season,"International TV Shows, TV Comedies, TV Dramas","During a visit to his motherland, a Korean-Italian mafia lawyer gives an unrivaled conglomerate a taste of its own medicine with a side of justice."
9,17,Sex Education,"19,667",83,98,YES,s33,TV Show,,"Asa Butterfield, Gillian Anderson, Ncuti Gatwa, Emma Mackey, Connor Swindells, Kedar Williams-Stirling, Alistair Petrie",United Kingdom,"September 17, 2021",2020,Adults,3 Seasons,"British TV Shows, International TV Shows, TV Comedies","Insecure Otis has all the answers when it comes to sex advice, thanks to his therapist mom. So rebel Maeve proposes a school sex-therapy clinic."
10,18,Riverdale,"18,915",60,226,No,s677,TV Show,Rob Seidenglanz,"K.J. Apa, Lili Reinhart, Camila Mendes, Cole Sprouse, Marisol Nichols, Madelaine Petsch, Ashleigh Murray, Mädchen Amick, Luke Perry, Casey Cott, Charles Melton, Mark Consuelos, Lochlyn Munro, Peter Bryant, Colin Lawrence, Molly Ringwald, Asha Bromfield, Barclay Hope, Hayley Law, Martin Cummins, Sarah Habel, Nathalie Boltt, Skeet Ulrich",United States,"June 19, 2021",2019,Teens,4 Seasons,"Crime TV Shows, TV Dramas, TV Mysteries","While navigating the troubled waters of sex, romance, school and family, teen Archie and his gang become entangled in a dark Riverdale mystery."
11,20,Behind Her Eyes,"17,409",80,73,YES,s1302,TV Show,,"Simona Brown, Eve Hewson, Tom Bateman, Robert Aramayo, Tyler Howitt, Georgie Glen",United Kingdom,"February 17, 2021",2021,Adults,1 Season,"British TV Shows, International TV Shows, TV Dramas",A single mother enters a world of twisted mind games when she begins an affair with her psychiatrist boss while secretly befriending his mysterious wife.
12,22,Friends,"16,539",41,359,No,s6807,TV Show,,"Jennifer Aniston, Courteney Cox, Lisa Kudrow, Matt LeBlanc, Matthew Perry, David Schwimmer",United States,,2003,Teens,10 Seasons,"Classic & Cult TV, TV Comedies","This hit sitcom follows the merry misadventures of six 20-something pals as they navigate the pitfalls of work, life and love in 1990s Manhattan."
13,23,Shadow and Bone,"16,403",82,55,YES,s994,TV Show,,"Jessie Mei Li, Archie Renaux, Ben Barnes, Freddy Carter, Amita Suman, Kit Young, Danielle Galligan, Calahan Skogman, Sujaya Dasgupta, Simon Sears, Daisy Head, Zoë Wanamaker, Luke Pasqualino, Julian Kostov",United States,"April 23, 2021",2021,Teens,1 Season,"TV Action & Adventure, TV Dramas, TV Sci-Fi & Fantasy",Dark forces conspire against orphan mapmaker Alina Starkov when she unleashes an extraordinary power that could change the fate of her war-torn world.
14,24,Snowpiercer,"15,699",74,98,YES,s556,Movie,Bong Joon Ho,"Chris Evans, Song Kang-ho, Ed Harris, John Hurt, Tilda Swinton, Jamie Bell, Octavia Spencer, Ewen Bremner, Alison Pill, Adnan Haskovic, Vlad Ivanov, Ko A-sung, Luke Pasqualino","South Korea, Czech Republic","July 2, 2021",2013,Adults,126 min,"Action & Adventure, Cult Movies, International Movies",The Earth's remaining inhabitants are confined to a single train circling the globe as revolution brews among the class-divided cars.
15,25,Sweet Tooth,"15,457",82,40,YES,s764,TV Show,,"Nonso Anozie, Christian Convery, Adeel Akhtar, Stefania LaVie Owen, Dania Ramirez, Aliza Vellani, Will Forte, James Brolin, Neil Sandilands, Mia Artemis",United States,"June 4, 2021",2021,Teens,1 Season,"TV Action & Adventure, TV Dramas, TV Sci-Fi & Fantasy","On a perilous adventure across a post-apocalyptic world, a lovable boy who's half-human and half-deer searches for a new beginning with a gruff protector."
16,26,Hometown Cha-Cha-Cha,"15,210",52,124,YES,s187,TV Show,,"Shin Min-a, Kim Seon-ho, Lee Sang-yi, Gong Min-jeung, Kim Young-ok, Cho Han-cheul, In Gyo-jin, Lee Bong-ryeon, Cha Cheong-hwa, Kang Hyung-suk",,"August 29, 2021",2021,Teens,1 Season,"International TV Shows, Romantic TV Shows, TV Comedies","A big-city dentist opens up a practice in a close-knit seaside village, home to a charming jack-of-all-trades who is her polar opposite in every way."
17,28,Firefly Lane,"14,682",77,44,YES,s1349,TV Show,,"Katherine Heigl, Sarah Chalke, Ben Lawson, Beau Garrett, Ali Skovbye, Roan Curtis, Yael Yurman, Jon-Michael Ecker, Brandon Jay McLaren, Paul McGillion, Chelah Horsdal, Brendan Taylor",United States,"February 3, 2021",2021,Adults,1 Season,"Romantic TV Shows, TV Dramas",Best friends Tully and Kate support each other through good times and bad with an unbreakable bond that carries them from their teens to their 40s.
18,29,Elite,"14,208",77,75,YES,s685,TV Show,,"Danna Paola, Miguel Herrán, María Pedraza, Itzan Escamilla, Miguel Bernardeau, Jaime Lorente, Álvaro Rico, Arón Piper, Mina El Hammani, Ester Expósito, Omar Ayuso",Spain,"June 18, 2021",2021,Adults,4 Seasons,"Crime TV Shows, International TV Shows, Spanish-Language TV Shows","When three working-class teens enroll in an exclusive private school in Spain, the clash between them and the wealthy students leads to murder."
19,30,Outer Banks,"14,109",72,46,YES,s371,TV Show,,"Chase Stokes, Madelyn Cline, Madison Bailey, Jonathan Daviss, Rudy Pankow, Charles Esten, Adina Porter, Austin North, Drew Starkey",United States,"July 30, 2021",2021,Adults,2 Seasons,"TV Action & Adventure, TV Dramas, Teen TV Shows","On an island of haves and have-nots, teen John B enlists his three best friends to hunt for a legendary treasure linked to his father's disappearance."
20,31,The Witcher,"14,055",89,236,YES,s3118,TV Show,,"Henry Cavill, Anya Chalotra, Freya Allan, Jodhi May, MyAnna Buring, Joey Batey, Eamon Farren, Mimi Ndiweni, Björn Hlynur Haraldsson, Adam Levy, Lars Mikkelsen, Royce Pierreson, Wilson Radjou-Pujalte, Anna Shaffer","United States, Poland","December 20, 2019",2019,Adults,1 Season,"International TV Shows, TV Action & Adventure, TV Dramas","Geralt of Rivia, a mutated monster-hunter for hire, journeys toward his destiny in a turbulent world where people often prove more wicked than beasts."
21,33,Sexify,"12,865",78,50,YES,s969,TV Show,,"Aleksandra Skraba, Maria Sobocińska, Sandra Drzymalska, Piotr Pacek, Kamil Wodka, Jan Wieteska, Wojciech Solarz",Poland,"April 28, 2021",2021,Adults,1 Season,"International TV Shows, TV Comedies, TV Dramas","To build an innovative sex app and win a tech competition, a sexually inexperienced student and her friends must explore the daunting world of intimacy."
22,34,Fate: The Winx Saga,"12,570",82,40,YES,s1059,TV Show,,"Abigail Cowen, Hannah Van Der Westhuysen, Precious Mustapha, Eliot Salt, Elisha Applebaum, Danny Griffin, Sadie Soverall, Freddie Thorp, Rob James-Collier, Eve Best, Lesley Sharp","Italy, United Kingdom","April 14, 2021",2021,Adults,1 Season,"British TV Shows, International TV Shows, TV Dramas","Determined to master their enchanting powers, a group of teens navigate rivalry, romance and supernatural studies at Alfea, a magical boarding school."
23,35,The Blacklist,"12,054",57,333,No,s1981,TV Show,,"James Spader, Megan Boone, Diego Klattenhoff, Ryan Eggold, Harry Lennix, Amir Arison, Hisham Tawfiq, Mozhan Marnò",United States,"September 18, 2020",2019,Teens,7 Seasons,"Crime TV Shows, TV Dramas, TV Thrillers","After turning himself in, a brilliant fugitive offers to help the FBI bag other baddies, but only if rookie profiler Elizabeth Keen is his partner."
24,36,Clickbait,"12,010",80,43,YES,s223,TV Show,Brad Anderson,"Zoe Kazan, Betty Gabriel, Adrian Grenier, Phoenix Raei, Abraham Lim, Jessica Collins, Camaron Engels, Jaylin Fletcher, Liz Alexander, Joyce Guy, Daniel Henshall, Ian Meadows, Jamie Timony, Steve Mouzakis, Becca Lish",,"August 25, 2021",2021,Adults,1 Season,"Crime TV Shows, TV Dramas, TV Mysteries","When family man Nick Brewer is abducted in a crime with a sinister online twist, those closest to him race to uncover who is behind it and why."
25,38,Too Hot to Handle,"11,584",74,67,YES,s649,TV Show,,Desiree Burch,United States,"June 23, 2021",2021,Adults,2 Seasons,"Reality TV, Romantic TV Shows","On the shores of paradise, gorgeous singles meet and mingle. But there’s a twist. To win a $100,000 grand prize, they’ll have to give up sex."
26,39,Dynasty,"11,091",78,137,YES,s2474,TV Show,,"Elizabeth Gillies, Nathalie Kelley, Grant Show, James Mackay, Rafael De La Fuente, Alan Dale, Sam Adegoke, Robert Christopher Riley",United States,"May 23, 2020",2019,Teens,3 Seasons,TV Dramas,The Carringtons and the Colbys feud for control over their fortune – and their children – in this updated reboot of the classic prime-time soap.
27,40,Never Have I Ever,"11,035",79,48,YES,s460,TV Show,,"Maitreyi Ramakrishnan, Poorna Jagannathan, Richa Moorjani, Jaren Lewison, Darren Barnet, John McEnroe, Ramona Young, Lee Rodriguez, Sendhil Ramamurthy, Adam Shapiro, Niecy Nash, Cocoa Brown, Lily D. Moore, Eddie Liu",United States,"July 15, 2021",2021,Teens,2 Seasons,"TV Comedies, TV Dramas, Teen TV Shows","After a traumatic year, all an Indian-American teen wants is to go from pariah to popular — but friends, family and feelings won’t make it easy on her."
28,41,Virgin River,"10,939",75,62,YES,s489,TV Show,,"Alexandra Breckenridge, Martin Henderson, Tim Matheson, Annette O'Toole, Colin Lawrence, Jenny Cooper, Lauren Hammersley",United States,"July 9, 2021",2021,Teens,3 Seasons,"Romantic TV Shows, TV Dramas","Searching for a fresh start, a nurse practitioner moves from LA to a remote northern California town and is surprised by what – and who – she finds."
29,42,Jupiter's Legacy,"10,782",81,26,YES,s909,TV Show,,"Josh Duhamel, Ben Daniels, Leslie Bibb, Andrew Horton, Elena Kampouris, Matt Lanter, Mike Wade, Tenika Davis, Ian Quinlan, David Julian Hirsh, Tyler Mane",United States,"May 7, 2021",2021,Adults,1 Season,"TV Action & Adventure, TV Sci-Fi & Fantasy","They're the first generation of superheroes. But as they pass the torch to their children, tensions are rising — and the old rules no longer apply."
30,44,The Queen of Flow,"10,485",28,172,YES,s4407,TV Show,,"Carolina Ramírez, Carlos Torres, Andrés Sandoval, Adriana Arango, Mabel Moreno, Luis Alfredo Velasco, Pacho Rueda, Diana Wiswell, Mariana Garzón, Kiño, Sebastián Silva, Mariana Gómez, María José Vargas, Guillermo Blanco, Juan Manuel Restrepo, Alejandro Otero, David Ojalvo",Colombia,"November 9, 2018",2018,Adults,1 Season,"Crime TV Shows, International TV Shows, Spanish-Language TV Shows","Seventeen years after being wrongly imprisoned, a talented songwriter seeks justice against the men who caused her downfall and killed her family."
31,46,The Queen's Gambit,"10,317",76,198,YES,s1805,TV Show,,"Anya Taylor-Joy, Bill Camp, Marielle Heller, Thomas Brodie-Sangster, Moses Ingram, Harry Melling, Isla Johnston, Christiane Seidel, Rebecca Root, Chloe Pirrie, Jacob Fortune-Lloyd",United States,"October 23, 2020",2020,Adults,1 Season,TV Dramas,"In a 1950s orphanage, a young girl reveals an astonishing talent for chess and begins an unlikely journey to stardom while grappling with addiction."
32,47,Hit & Run,"10,271",79,49,YES,s297,TV Show,,"Lior Raz, Kaelen Ohm, Sanaa Lathan, Moran Rosenblatt, Lior Ashkenazi, Gregg Henry, Gal Toren","Israel, United States","August 6, 2021",2021,Adults,1 Season,"TV Action & Adventure, TV Dramas, TV Mysteries",A man searching for the truth behind his wife's death becomes caught up in a dangerous web of secrets and intrigue stretching from New York to Tel Aviv.
33,51,Narcos: Mexico,"9,134",81,47,YES,s2922,TV Show,,"Michael Peña, Diego Luna, Tenoch Huerta, Joaquin Cosio, José María Yazpik, Matt Letscher, Alyssa Diaz","Mexico, United States","February 13, 2020",2020,Adults,2 Seasons,"Crime TV Shows, TV Action & Adventure, TV Dramas","Witness the birth of the Mexican drug war in the 1980s as a gritty new ""Narcos"" saga chronicles the true story of the Guadalajara cartel's ascent."
34,52,The Irregulars,"8,959",82,35,YES,s1167,TV Show,,"Mckell David, Thaddea Graham, Jojo Macari, Harrison Osterfield, Darci Shaw, Clarke Peters, Royce Pierreson, Henry Lloyd-Hughes",United Kingdom,"March 26, 2021",2021,Teens,1 Season,"British TV Shows, Crime TV Shows, International TV Shows","A crew of misfits investigates a series of supernatural crimes in Victorian London for Dr. Watson and his shadowy associate, Sherlock Holmes."
35,54,Lost in Space,"8,837",87,29,YES,s3107,TV Show,,"Molly Parker, Toby Stephens, Max Jenkins, Taylor Russell, Mina Sundwall, Parker Posey, Ignacio Serricchio",United States,"December 24, 2019",2019,Older Kids,2 Seasons,"TV Action & Adventure, TV Dramas, TV Sci-Fi & Fantasy","After crash-landing on an alien planet, the Robinson family fights against all odds to survive and escape. But they're surrounded by hidden dangers."
36,55,Cobra Kai,"8,830",77,59,YES,s1449,TV Show,,"Ralph Macchio, William Zabka, Xolo Maridueña, Martin Kove, Mary Mouser, Tanner Buchanan, Courtney Henggeler, Jacob Bertrand",United States,"January 1, 2021",2021,Teens,3 Seasons,"TV Action & Adventure, TV Comedies, TV Dramas","Decades after the tournament that changed their lives, the rivalry between Johnny and Daniel reignites in this sequel to the ""Karate Kid"" films."
37,56,Good Girls,"8,542",72,71,YES,s1307,TV Show,,"Christina Hendricks, Retta, Mae Whitman, Matthew Lillard, Reno Wilson, Manny Montana, Lidya Jewett, Izzy Stannard, David Hornsby, Zach Gilford",United States,"February 16, 2021",2020,Adults,3 Seasons,"Crime TV Shows, TV Comedies, TV Dramas",Three suburban moms orchestrate a local grocery store heist to escape financial ruin and establish independence – together.
38,60,The Snitch Cartel: Origins,"7,815",16,86,YES,s382,TV Show,,"Juan Pablo Urrego, Sebastián Osorio, Patricia Tamayo, Verónica Velásquez, María Camila Zárate, Nicole Santamaría, Eduardo Pérez, Julian Farrieta, Gustavo Angarita Jr., Carlos Manuel Vesga, Helena Mallarino, David Prada, Margarita Reyes, Adriana Silva, Laura Rodríguez, Angélica Blandón, Maia Landaburu, Jesús de los Ríos",,"July 28, 2021",2021,Adults,1 Season,"Crime TV Shows, International TV Shows, Spanish-Language TV Shows","Over four decades, two brothers in Cali juggle family duties, multiple romances and illegal businesses, transforming from poor kids to cocaine kingpins."
39,62,The Circle,"7,708",55,74,YES,s96,TV Show,,Michelle Buteau,"United States, United Kingdom","September 8, 2021",2021,Adults,3 Seasons,Reality TV,"Status and strategy collide in this social experiment and competition show where online players flirt, befriend and catfish their way toward $100,000."
40,63,Locke & Key,"7,584",84,45,YES,s2942,TV Show,,"Darby Stanchfield, Connor Jessup, Emilia Jones, Jackson Robert Scott, Petrice Jones, Laysla De Oliveira, Griffin Gluck, Sherri Saum, Aaron Ashmore, Bill Heck, Genevieve Kang, Kevin Alves, Thomas Mitchell Barnet, Eric Graise, Felix Mallard, Martin Roach, Steven Williams, Coby Bird","Canada, United States","February 7, 2020",2020,Teens,1 Season,"TV Action & Adventure, TV Dramas, TV Mysteries","After their dad's murder, three siblings move with their mom to his ancestral estate, where they discover magical keys that unlock powers — and secrets."
41,65,Ragnarok,"7,540",79,42,YES,s838,TV Show,,"David Stakston, Jonas Strand Gravli, Herman Tømmeraas, Theresa Frostad Eggesbø, Emma Bones, Henriette Steenstrup, Gísli Örn Garðarsson, Synnøve Macody Lund, Ylva Thedin Bjørkaas, Odd-Magnus Williamson","Norway, Denmark","May 27, 2021",2021,Adults,2 Seasons,"International TV Shows, TV Action & Adventure, TV Dramas","In a Norwegian town poisoned by pollution and rattled by melting glaciers, the End Times feel all too real. It’ll take a legend to battle an old evil."
42,68,Hospital Playlist,"7,105",16,227,YES,s687,TV Show,,"Cho Jung-seok, Yoo Yeon-seok, Jung Kyung-ho, Kim Dae-myeong, Jeon Mi-do, Kim Hae-suk, Kim Kap-soo, Jung Moon-sung",South Korea,"June 18, 2021",2021,Teens,2 Seasons,"International TV Shows, Korean TV Shows, TV Comedies","Every day is extraordinary for five doctors and their patients inside a hospital, where birth, death and everything in between coexist."
43,69,The Cook of Castamar,"7,006",66,133,YES,s488,TV Show,,"Michelle Jenner, Roberto Enríquez, Hugo Silva, Maxi Iglesias, María Hervás, Agnès Llobet, Paula Usero, Jean Cruz, Óscar Rabadán, Fiorella Faltoyano, Nancho Novo, Silvia Abascal, Mónica López",,"July 9, 2021",2021,Adults,1 Season,"International TV Shows, Romantic TV Shows, Spanish-Language TV Shows","In 1720 Madrid, a talented cook catches the eye of a widowed duke just as he returns to aristocratic society. Based on the novel by Fernando J. Múñez."
44,70,The Cook of Castamar,"7,006",66,133,YES,s488,TV Show,,"Michelle Jenner, Roberto Enríquez, Hugo Silva, Maxi Iglesias, María Hervás, Agnès Llobet, Paula Usero, Jean Cruz, Óscar Rabadán, Fiorella Faltoyano, Nancho Novo, Silvia Abascal, Mónica López",,"July 9, 2021",2021,Adults,1 Season,"International TV Shows, Romantic TV Shows, Spanish-Language TV Shows","In 1720 Madrid, a talented cook catches the eye of a widowed duke just as he returns to aristocratic society. Based on the novel by Fernando J. Múñez."
45,71,Demon Slayer: Kimetsu no Yaiba,"6,866",63,259,No,s1386,TV Show,,"Natsuki Hanae, Akari Kito, Hiro Shimono, Yoshitsugu Matsuoka, Takahiro Sakurai, Hochu Otsuka, Yuki Kaji, Ai Kakuma, Nobuhiko Okamoto, Toshiyuki Morikawa, Aoi Yuki, Shiori Izawa, Daisuke Namikawa, Takumi Yamazaki, Hikaru Midorikawa, Takehito Koyasu",Japan,"January 22, 2021",2019,Teens,1 Season,"Anime Series, International TV Shows","After a demon attack leaves his family slain and his sister cursed, Tanjiro embarks upon a perilous journey to find a cure and avenge those he's lost."
46,72,The One,"6,824",71,36,YES,s1218,TV Show,,"Hannah Ware, Zoë Tapper, Dimitri Leonidas, Amir El-Masry, Lois Chimimba, Eric Kofi-Abrefa, Pallavi Sharda, Jana Pérez, Diarmaid Murtagh, Gregg Chillin, Wilf Scolding, Stephen Campbell Moore, Simone Kirby, Albano Jerónimo, Eduardo Lloveras, Miguel Amorim",United Kingdom,"March 12, 2021",2021,Adults,1 Season,"British TV Shows, Crime TV Shows, International TV Shows","Love — and lies — spiral when a DNA researcher helps discover a way to find the perfect partner, and creates a bold new matchmaking service."
47,73,Emily in Paris,"6,735",90,25,YES,s1895,TV Show,,"Lily Collins, Philippine Leroy-Beaulieu, Ashley Park, Lucas Bravo, Kate Walsh, Samuel Arnold, Bruno Gouery, Camille Razat",United States,"October 2, 2020",2020,Adults,1 Season,"Romantic TV Shows, TV Comedies, TV Dramas","After landing her dream job in Paris, Chicago marketing exec Emily Cooper embraces her adventurous new life while juggling work, friends and romance."
48,74,Sky Rojo,"6,472",61,78,YES,s402,TV Show,,"Verónica Sánchez, Miguel Ángel Silvestre, Asier Etxeandia, Lali Espósito, Yany Prado, Enric Auquer, Luis Zahera, Carmen Santamaría, Cecilia Gómez, Godeliv Van den Brandt, Penélope Guerrero, Luisa Vides, Niko Verona, Chema Ruiz",Spain,"July 23, 2021",2021,Adults,2 Seasons,"International TV Shows, Spanish-Language TV Shows, TV Action & Adventure",A fatal turn of events at a brothel sends three women haunted by their pasts on a wild run from their pimp and his henchmen.
49,75,Alice in Borderland,"6,458",70,62,YES,s1563,TV Show,,"Kento Yamazaki, Tao Tsuchiya, Nijiro Murakami, Yuki Morinaga, Keita Machida, Ayaka Miyoshi, Dori Sakurada, Aya Asahina, Shuntaro Yanagi, Yutaro Watanabe, Ayame Misaki, Mizuki Yoshida, Tsuyoshi Abe, Nobuaki Kaneko, Sho Aoyagi, Riisa Naka",Japan,"December 10, 2020",2020,Adults,1 Season,"International TV Shows, TV Action & Adventure, TV Mysteries","An aimless gamer and his two friends find themselves in a parallel Tokyo, where they're forced to compete in a series of sadistic games to survive."
50,76,Crime Scene: The Vanishing at the Cecil Hotel,"6,240",79,21,YES,s1329,TV Show,Joe Berlinger,,United States,"February 10, 2021",2021,Adults,1 Season,"Crime TV Shows, Docuseries","The notorious Cecil Hotel grows in infamy when guest Elisa Lam vanishes. From the creator of ""The Ted Bundy Tapes,"" a dive into crime's darkest places."
51,77,StartUp,"5,978",62,59,No,s922,TV Show,,"Adam Brody, Edi Gathegi, Otmara Marrero, Martin Freeman, Ron Perlman, Addison Timlin, Mira Sorvino",United States,"May 4, 2021",2018,Adults,3 Seasons,"Crime TV Shows, TV Dramas",An attempt to launder stolen money finances a cryptocurrency that puts entrepreneurs in business with a corrupt FBI agent and a Miami gang.
52,78,Turning Point: 9/11 and the War on Terror,"5,915",70,25,YES,s182,TV Show,,,,"September 1, 2021",2021,Teens,1 Season,Docuseries,"This unflinching series documents the 9/11 terrorist attacks, from Al Qaeda's roots in the 1980s to America's response, both at home and abroad."
53,80,Formula 1: Drive to Survive,"5,818",70,49,YES,s1183,TV Show,,,United Kingdom,"March 19, 2021",2021,Adults,3 Seasons,Docuseries,"Drivers, managers and team owners live life in the fast lane – both on and off the track – during one cutthroat season of Formula 1 racing."
54,82,Chilling Adventures of Sabrina,"5,664",76,21,YES,s1474,TV Show,,"Kiernan Shipka, Ross Lynch, Miranda Otto, Lucy Davis, Chance Perdomo, Michelle Gomez, Richard Coyle, Jaz Sinclair, Lachlan Watson, Tati Gabrielle, Adeline Rudolph, Abigail Cowen, Gavin Leatherwood, Bronson Pinchot",United States,"December 31, 2020",2020,Teens,4 Seasons,"TV Horror, TV Mysteries, TV Sci-Fi & Fantasy","Magic and mischief collide as half-human, half-witch Sabrina navigates between two worlds: mortal teen life and her family's legacy, the Church of Night."
